Question,Answer
"[종합정보관리시스템 참여신진연구인력 관리 관련] 참여신진연구인력 관리 관련 - 안녕하세요. 종합정보관리시스템-참여신진연구인력 관리에서 신진연구인력을 등록하려고 하는데, 참여기간이 2025년9월16일부터 참여한 박사후연구원이 있습니다. 시스템 상에서 참여기간을 2025년9월16일부터 2026년 2월 28일까지 입력하면 참여개월수가 6개월이 아닌 5개월로 셋팅되어 인건비 지급내역을 5개월치만 입력할 수 있습니다. 첫 달의 참여기간이 15일 미만이어서 1달로 카운트가 되지 않는 것 같은데, 이런경우는 인건비 지급내역은 어떻게 입력해야 하나요? 9월과 10월 인건비를 합쳐서 입력하면 될까요?",안녕하세요. BK21사업팀입니다. 해당 신진연구인력 연구자번호를 tan@nrf.re.kr 로 보내주시기 바랍니다.
"BK21 5단계 준비위원회 위원장 관련 참여교수 소속 여부 - BK21 담당자님께, 안녕하세요. 차기 BK21 5단계 사업 진입을 준비하기 위해 대학 내부에 '5단계 준비위원회(운영위원회)'를 구성하고자 합니다. 위원장 보직과 관련하여 아래 사항을 문의드립니다. 준비위원장의 4단계 참여 필수 여부: 5단계 사업 기획을 총괄할 준비위원장 교수님이 현재 4단계 사업에 '참여교수'로 소속되어 있지 않아도, 준비위원회 위원장직을 수행하며 사업 기획을 주도하는 데 행정적인 제한이 있습니까? 5단계 사업 시 참여 필수 여부: 만약 4단계 참여교수가 아니어도 무방하다면, 향후 5단계 사업이 시작되는 시점에는 반드시 참여교수로 등록되어야만 위원장(또는 기획 책임) 역할을 유지할 수 있는 것인지 궁금합니다. 전 과정 미참여 시 결격 사유: 준비위원장이 4단계 및 5단계 사업 전체 기간 동안 '참여교수'로 등록되지 않은 상태에서, 오직 사업 기획 및 운영위원회 위원장 역할만 수행하는 것이 가능한지 확인 부탁드립니다.","안녕하세요. BK21사업팀입니다. 자체적으로 만드신 위원회인데, 저희가 정해드릴 수 있는 건 없습니다. 자체운영규정에 명시하여 운영해 주시기 바랍니다. 아울러 5단계는 아직 기획 중이라 현 상황에선 답변이 불가합니다."
교육연구단 운영비 집행 문의 - 교육연구단 운영비 집행 문의드립니다. 신진연구인력 채용을 위한 채용사이트 게시비용을 연구단 운영비로 집행 가능한지 문의드립니다.,(수정 답변) 안녕하십니까? BK21사업팀입니다. 교육연구단 운영비 - 일반수용비에서 집행하시기 바랍니다. 감사합니다.
"산재보험 가입 대학원생의 참여대학원생 자격 여부 문의 - 안녕하세요. 참여대학원생의 산재보험 가입으로 인한 참여대학원생 자격 유지와 관련하여 문의드립니다. 해당 학생은 대학 내 지역 RISE 사업단과 근로계약을 체결하여 단기근로자로 근무할 예정입니다. 근로계약으로 학생이 담당할 업무는 사업단에서 기획, 운영하는 대중강연의 진행을 위한 사전 준비와 간단한 행정 업무입니다. 위 대중강연은 학생이 참여 중인 교육연구단의 사업 목적에 부합합니다. 학생이 대학 내 지역 RISE 사업단과의 근로계약을 체결할 시, 산재보험을 필수, 의무적으로 가입해야 한다고 합니다. 4대보험 가입내역서에는 산재보험 란에 '사업장 가입자(대학 지역 RISE 사업단)'으로 뜨는 것으로 확인됩니다. 위 학생이 근로계약을 체결하여 산재보험에 자동 가입될 경우에 참여대학원생의 자격을 유지할 수 있는지 알려주시면 감사하겠습니다.","안녕하십니까 BK21사업팀입니다. 근로계약을 체결하고 4대 보험에 가입하는 경우, 참여대학원생 요건을 충족하지 않으므로 참여종료 처리하시기 바랍니다. (4단계 BK21사업 관리운영지침 제11조(참여대학원생) 참고) 감사합니다."
"교육연구단장 변경 관련 - 안녕하세요. 교육연구단장 변경과 관련하여 문의드립니다. BK21 사업관리 운영지침에 따르면, 교육연구단장은 국가 주도 대형 연구개발사업의 책임자 또는 연간 사업비 20억 원 이상인 국가연구개발과제의 책임자를 겸할 수 없는 것으로 명시되어 있습니다. 이와 관련하여, 현재 저희 교육연구단장님께서 연간 20억 원 이상의 과제를 금년 7월부터 수행하게 될 가능성이 있는 상황입니다. 이에 따라 운영지침에 근거하여 교육연구단장을 변경해야 하는 것으로 이해하고 있으나, 일부 타 사업의 경우 전체 사업기간이 얼마 남지 않은 상황에서는 기존 책임자가 계속 수행하는 사례도 있는 것으로 알고 있습니다. 저희 BK21 사업의 경우 종료일이 2027년 8월 31일로 약 1년여의 기간이 남아있는 상황인데, 이와 같은 경우에도 반드시 교육연구단장을 변경해야 하는지, 아니면 별도 변경 없이 유지가 가능한지 문의드립니다. 확인 후 회신 주시면 감사하겠습니다. 감사합니다.","안녕하십니까 BK21사업팀입니다. 교육연구단(팀)장이 국가 주도 대형 연구개발사업의 책임자 또는 연간 사업비 20억 원 이상의 연구개발과제 책임자를 수행하게 되는 경우, 단장 변경을 진행하시기 바랍니다. 감사합니다."
"장학금 중복수혜 가능 문의 - 안녕하십니까. 기초과학분야 미래인재양성사업 교육연구단입니다. 대학원생 BK 장학금 중복수혜 관련 문의드립니다. ""2026년 대학원 대통력과학장학금""(첨부파일) 학생에 선정되어 장학금을 수혜할 경우, BK 장학금과 중복 수혜 가능한지 문의드립니다. 미리 감사합니다.","안녕하세요. BK21사업팀입니다. BK사업에선 중복 수혜가 가능하나, 해당 사업에서 중복 수혜 가능 여부를 확인하시기 바랍니다."
"사용실적보고서 인건비 입력 시 시스템 오류 발생에 따른 문의 - 안녕하세요. 사용실적보고서 작성 중 오류가 발생하여 문의드립니다. '연구비 사용 명세서 → 인건비 사용실적 → 신진연구인력 인건비 → 엑셀 업로드' 에서 행 추가 및 엑셀 업로드 방식 모두 시도하였으나, 특정 인원의 데이터를 입력할 경우 아래와 같은 오류가 발생하며 저장이 되지 않습니다. 반면, 다른 인원의 데이터는 정상적으로 저장됩니다. 오류 메시지: SqlMapClient operation; uncategorized SQLException for SQL []; SQL state [null]; error code [0]; Error: executeQueryForObject returned too many results.; nested exception is java.sql.SQLException: Error: executeQueryForObject returned too many results. 해당 오류의 원인과 해결 방법에 대해 안내 부탁드립니다. 감사합니다.",안녕하세요. BK21사업팀입니다. 해당 엑셀 파일을 tan@nrf.re.kr 로 보내주시기 바랍니다.
"참여교수 국제 학술대회 참가 비용 지원 관련 추가 문의 (16351 문의글 관련) - 안녕하세요. 참여교수 국제 학술대회 참가 비용 지원과 관련하여 16351 문의글에서 말씀드린 바와 같이 아래와 같은 규정을 확인하였고 실제 경비 집행에 대해서는 구체적인 언급이 없는 상황입니다.
'참여교수는 지도하고 있는 참여대학원생이 발표논문의 저자로서 국제학술대회에 참여하는 경우에 한하여 지원할 수 있다.'
다음은 문의사항입니다.
1. 발표논문의 저자이자 국제 학술대회에 참여하는 참여대학원생의 참가 등록비, 운임비 등 여비를 참여교수의 다른 연구과제에서 지원받을 경우 참여교수의 경비를 BK21사업비에서 지원받을 수 있는지, 참여대학원생의 경비 역시 BK21사업비에서 지원받아야 참여교수 경비까지 지원받을 수 있는 것인지 문의드립니다.
2. A 학술대회 개최지의 인접 국가에서 개최되는 B 학술대회의 기간이 겹쳐 두 학술대회 모두 참가한다고 하였을 때, A 학술대회에서 논문을 발표하는 참여대학원생①의 경우 출장비를 참여교수의 다른 연구과제에서 지원받고 참여대학원생②의 경우 A 학술대회는 단순 참가이지만 B 학술대회에서는 발표를 진행하며 출장비를 BK21사업에서 지원받습니다. 이 경우 참여교수의 한국 ↔ A 학술대회 개최 국가 왕복 운임비 등 출장비를 BK21사업비에서 지원받을 수 있을지 문의드립니다. (당연히 출장비는 중복 지원받지 않습니다.)
3-1. 2번에서처럼 A, B 학술대회를 모두 참가한다고 하였을 때 참여인력의 국가 간 이동 운임비를 지원받을 수 있는지, 한국 출국/입국 왕복에 대해서만 지원받아야 하는지 문의드립니다.
3-2. 역시 참여교수의 국가 간 이동 운임비를 지원받을 수 있는지 문의드립니다.","안녕하십니까

BK21사업팀입니다.

1. 이전 답변을 확인하여 주시기 바랍니다.

2. 가능합니다(1번 답변과 동일).

3. 일정이 연속되었다면 사유서 및 증빙자료를 구비하시기 바랍니다.
(개인일정에 대한 지원은 불가)

감사합니다."
"해외 장단기 연수 비용 문의 - 안녕하세요. 참여 대학원생의 해외 장단기 연수 비용 시 비자발급 비용 지원 가능할까요? 가능하다면 예산항목 중 어느것으로 해야할까요? 그럼, 주신답변에 미리 감사드립니다.","안녕하십니까 BK21사업팀입니다, 비자발급 비용은 교내 여비 규정을 준용하시어 지원하시기 바랍니다. 감사합니다."
"재문의- D2비자가 아닌 다른비자의 외국인 대학원생 참여일자 - 16338번 문의글에서 위와 같은 답변을 받았습니다. 답변대로 사유서와 사증발급확인서가 있으면 3월1일자 참여가 가능하다는 말일까요?(추후 건강보험~, 4대보험~ 서류발급 후 구비예정) 아니면 4대보험가입내역서 발급시점으로 참여하는게 맞을까요? 다른 문의글을 봤을때 후자라고 답변하신걸 봤는데 정확한 답변 부탁드립니다. 미리 답변에 감사드립니다.",안녕하십니까 BK21사업팀입니다. D-2비자가 아닌 F-4 비자의 경우에는 4대보험가입내역확인서 및 건강보험자격득실확인서에서 확인 가능한 참여요건 충족 일자부터 참여 가능합니다. 감사합니다.
"중간 보고서 서식 관련 문의 - 안녕하세요. 중간보고서 서식과 관련되어 추가 공지가 한달째 없어 글 남깁니다. 다른 답변들을 확인하더라도, 추후 공지를 기다려달라는 답변을 해주고 계신데, 혹시 언제쯤... 추후 공지가 나올까요? 대략적인 일정이라도 알려주시면 감사하겠습니다.","안녕하십니까

BK21사업팀입니다.

중간평가 관련 일정은 추후 공지 및 공문 등을 확인하여 주시기 바랍니다.

감사합니다."
"연구활동 및 산학협력활동 지원비 집행 기준 문의 - 안녕하세요. 4단계 두뇌한국(BK)21 사업 예산편성 및 집행 기준에 대해 문의드립니다. 사업 예산편성 및 집행기준 제 17조 3항에서 ""교육연구단은 산학협력과 관련된 창업 및 취업지도, 산업체와의 산학협력 공동활동비 등 관련 경비를 집행할 수 있다.""고 되어 있습니다. 산업체와의 산학협력 공동활동비 등 관련 경비라는 것이 구체적으로 어느 것을 의미하는지 문의드립니다. 1. ""산업체와의 산학협력 공동활동비""는 취업, 창업지도와 연계된 산업체와의 활동이어야만 경비 사용을 할 수 있나요? 2. 교육연구단과 산업체와의 연구협력 방안 회의, 산업체 수요 맞춤 인력 양성 토론회 같은 활동 중 발생한 경비(음료, 다과 등)에 대해 산학협력 공동활동비로 집행이 가능한가요?","안녕하세요. BK21사업팀입니다. 1. 산업체와의 창업지도 워크숍, 산업체 방문, 견학, 회의, 행사개최, 전문가 초청 등 모든 협력 활동의 관련 경비로 집행 가능합니다. 2. 가능합니다."
"[연구비사용실적관리] 기타반납액 작성관련 - 안녕하세요. 연구비사용실적관리 내 '연구비 사용 명세서' 작성 중 기타반납액 기재와 관련하여 문의드립니다. 2025년도 사업비 사용한 금액 중 일부 건에 대해 여입 또는 환불 처리가 발생하였습니다. 여입 처리 건: 학회등록비 중 추가 옵션(식비)에 해당하는 금액을 여입 처리하였습니다. 환불 처리 건: 생성형 AI 사용료를 청구하였으나, 한 달 뒤(사업기간 종료 후) 일부 서비스 오류로 인해 미사용된 금액을 환불받았습니다. 환불(청구 미진행) 건: 생성형 AI 사용료 취소 요청으로 환불된 건으로, 해당 건은 청구 자체를 진행하지 않아 실적보고서에는 포함하지 않았습니다. 위 3가지 건 중 1번과 2번은 세부비목별 내역서에 각각 여입 금액 및 환불 금액을 마이너스(-)로 작성하였으며, 3번 건은 청구를 진행하지 않아 별도로 작성하지 않았습니다. 이와 같은 경우, 1번과 2번 금액을 기타반납액에도 별도로 기재해야 하는지 문의드립니다.",안녕하십니까. BK21사업팀입니다. 해당 사항은 연구정산총괄팀으로 유선문의 바랍니다. 감사합니다.
연회비 관련 문의드립니다. - 안녕하세요. 국내학회 연회비 문의드립니다. 연회비 + 회원등록비가 비회원등록비보다 저렴한데 연회비 지원이 가능할까요? 감사합니다.,"안녕하십니까 BK21사업팀입니다. 원칙은 일회성 참가비에 한하여 지원이 원칙입니다. 단, 논문게재를 위하여 반드시 연회비 납부가 필수 사항인 경우 또는 1회성 논문게재료 납부 보다 연회비가 저렴한 경우에는 사유서 및 증빙자료를 구비하여 주시기 바랍니다. 감사합니다."
"신진연구인력 인건비 BK종합시스템 입력 - 안녕하세요 혁신인재양성사업에 참여하고 있는 교육연구단입니다. BK 종합정보시스템 현행화와 관련하여 신진연구인력(박사후연구원) 인건비 지급에 대해서 기입하려고 합니다. 인건비 지급내역에 지급금액을 계약서상 금액으로 입력하면 되는지, 아니면 실제로 4대보험 기관부담금 등 포함하여 지출결의서에 실제로 해당 비목에서 지출된 금액을 기입하면 되는지 문의드립니다.",안녕하십니까 BK21사업팀입니다. 실제 지출된 금액을 기입바랍니다. 감사합니다.
해외 연구년 참여교수 국내개최 국제학술대회 참가 문의 - 안녕하세요. 2026년 해외 연구년중인 참여교수가 국내에서 개최되는 국제학술대회에 참가하고자 합니다. 항공료를 지원받고자 하는데 편도만 지원이 가능할까요? 왕복 티켓이 편도보다 훨씬 저렴하여 왕복으로 결제하려고 하는데 항공사에 문의해보니 편도 금액이 얼마인지 세부내역은 알수가 없다고 합니다. 편도 지원이 가능하다면 왕복 결제금액의 절반으로 지원해도 될까요? 감사합니다.,"안녕하십니까 BK21사업팀입니다. 해당 참여교수님이 참여교수 자격을 유지하고 있다면 BK21사업 예산편성 및 집행기준 제18조(국제화경비)에 따라 가능합니다(연구년으로 참여종료되었다면 지원 불가). (해당 학술대회가 국제(학술)대회 인정기준을 충족하고, 지도하고 있는 학생이 발표논문의 저자로서 해당 국제학술대회에 참여) 사유서 및 증빙자료를 구비하시기 바랍니다. 감사합니다."
"신청서 입력 시 참여 교원 자동 입력 안됨 - 안녕하세요, 지금 신청서 입력을 진행하고 있는데, 종합정보 관리시스템에서 사전 신청에는 모든 교원이 입력이 되어있습니다. 본 신청서 작성 시에, 교육연구단 참여교수 현환 탭에서, 사전입력정보생성하기를 누르면 1명이 빠진 값이 불러와 집니다. 입의로 행 추가하는 기능도 없는듯 한데, 어떻데 진행해야 할지요?","안녕하십니까

BK21사업팀입니다.

해당 사항 유선으로 안내된 것으로 확인됩니다.

감사합니다."
"[신규사업] 신청시 참여대학원생 자격 문의 - 안녕하세요? 이번 AI+X를 준비하고있습니다. 참여대학원생 중 회사를 퇴사하고 전일제 학생으로 학교를 다니고 있는데 전 회사가 아직 국민연금 처리를 하지 못해서 현재 4대보험 가입 내역확인서를 발급받으면 국민연금이 직장가입자로 나옵니다. 실제로는 회사를 다니지 않아서 전일제 대학원생인데.. 이런경우에는 지도교수, 연구단장님 확인을 받은 확인서를 구비 후 추후 참여대학원생 자격을 증명할 수 있는 서류를 구비하면 참여대학원생을 할 수 있을까요? 아니면 아예 참여를 하지 못하는걸까요?",안녕하십니까 BK21사업팀입니다. 해당 사항은 유선(042-869-6449)으로 문의바랍니다. 감사합니다.
"[Q&A] 참여교수 국제 학술대회 참가 비용 지원 관련 문의 - 안녕하세요? 참여교수 국제 학술대회 참가 비용 지원과 관련하여 문의드립니다. '참여교수는 지도하고 있는 참여대학원생이 발표논문의 저자로서 국제학술대회에 참여하는 경우에 한하여 지원할 수 있다.' 위와 같은 규정을 확인하였습니다. 발표논문의 저자이자 국제 학술대회에 참여하는 참여대학원생의 참가 등록비, 운임비 등 여비를 참여교수의 다른 연구과제에서 지원받을 경우 참여교수의 경비를 BK21사업비에서 지원받을 수 있는지, 참여대학원생의 경비 역시 BK21사업비에서 지원받아야 참여교수 경비까지 지원받을 수 있는 것인지 문의드립니다. 감사합니다.","안녕하십니까. BK21사업팀입니다. 참여대학원생이 타 과제에서 지원받더라도 참여교수에게 지원 가능하나, 사유서 구비가 필요합니다. (계획(안) 작성시 학생이 지원받는 해당 지원 예산을 포함하여 작성하시고, 교육연구단(팀) 예산이 아닌 타 비목에서 집행하는 사유 구비) 또한, 사전 내부문서(계획(안) 등) 작성 시 참여교수가 지도학생과 함께 참여하는 사실을 명시하시고, 결과보고에도 반영하여 주시기 바랍니다. 참여교수가 해당 학생의 지도교수이며, 참여교수 단독 참여가 아닌 학생과 함께 참여함을 증빙할 수 있는 서류를 구비하시기 바랍니다. 감사합니다."
"Q&A - 30일 초과 장기연수 연구장학금 일할 지급 관련 건 - 안녕하세요. 30일을 초과하는 장기연수 시 출국일을 기준으로 연구장학금 일할 계산 후 지원 중단하는 것으로 알고 있습니다. 본 사업단의 박사과정생이 코넬 대학으로부터 4월18일부터 5월 22일까지(35일) 초청을 받아 해외장기연수 대상으로 선정되었습니다. 그런데 해당 학생이 4월12일부터 4월18일까지 학회에 참석하여 구두발표를 진행하고 코넬 대학으로 바로 이동할 예정이라서 출국일이 4월12일입니다. 이런 경우, 학회 참석을 위해 출국하는 4월 12일을 기준으로 일할 계산 후, 지원 중단을 진행해야 하는지, 실제 해외장기연수기간, 즉 초청장의 초청일자 4월18일 기준으로 일할 계산 후, 지원 중단을 진행해야 하는 것인지 궁금합니다. 감사합니다.",안녕하세요. BK21사업팀입니다. 출국일 기준입니다.
"온라인 기반 해외저널 논문의 실적 인정 가능 여부 문의 - 안녕하세요. 온라인 저널 논문의 연구실적(사업 실적) 인정 기준과 관련하여 문의드립니다. SSCI 등재 해외 저널 중 온라인 기반으로 출판되는 경우, 권(Volume)·호(Issue) 없이 DOI 기반으로 논문이 제공되는 사례가 있습니다. 이와 같이 DOI만으로 식별되는 온라인 저널 논문의 경우에도 연구실적(사업 실적)으로 인정이 가능한지 확인 부탁드립니다. 감사합니다.","안녕하세요. BK21사업팀입니다. 25년 12월에 실시했던 성과 조사 분석을 위한 성과자료 시스템 입력 기준을 먼저 말씀드리면, 당해연도의 인쇄본으로 출판된 논문만 성과로 인정(단, Online 출판만 하는 저널의 경우는 예외)했습니다. 단 평가를 위한 성과나 실적 인정 기준은 평가마다 다를 수 있으니, 공고되는 평가의 지표, 항목 등을 참고해 주시기 바랍니다."
"해외 파견 인건비 관련 질의 - 안녕하세요, BK 21 사업에 참여 중인 대학원생입니다. IITP와 서강대학교에서 주관하는 해외 파견 사업에 선정되어 26.08~27.02에 해외 파견을 다녀오는데, BK 21 사업에 참여 인원으로 인건비를 받을 수 있을 지 문의 드립니다. 감사합니다.",안녕하세요. BK21사업팀입니다. 연수기간이 30일을 초과하는 경우 연구장학금 지원 불가합니다.
[사업단전담직원 관련 문의] 연구단에서 사업단 전담 계약직원을 추가로 1명 고용할 예정입니다. 기존 있던 직원과 가족관계여도 무관한지 문의드립니다.,안녕하세요. BK21사업팀입니다. 대학의 채용 규정 및 기준을 준용하시기 바랍니다.
"외국인 대학원생 참여자격 확인 - 현재 외국인 대학원생을 과제에 참여인력으로 등록하고자 합니다. 비자연장을 위해 신청한 상태로 만료 한달전 이미 비자연장 프로세스를 신청 (3월 초)하여 진행중인 상태입니다. (만료일: 3월 31일) 이로 인해 4대보험가입 증빙을 할 수 없는데, 과제 참여가 가능한지 판단이 어려워 문의드립니다.","안녕하세요. BK21사업팀입니다. 전일제 여부에 부합하는지 확인해야 합니다. 4대보험 가입내역서 및 건강보험 자격득실 확인서를 통해 자격을 검증해야 하지만, 외국인등록증 상 유학비자(D-2) 및 체류기간(총 체류기간 내 참여기간 포함)을 확인할 수 있는 경우 대체 가능합니다."
"외국인 학생 참여시작일 확인 - 안녕하세요? 미래수의학선도교육연구단입니다. 외국인 학생관련 문의드립니다. [사증발급확인서] - 체류자격:D-2-4 - 체류기간 1년 - 사증 유효기간: 2026.05.24 [외국인등록증] - 체류자격: D-2 - 체류기간: 2026.4.9~2027.03.31 위 내용과 같을 경우, 해당 학생의 참여 시작일을 1) 2026.03.01~ 부터 참여시작이 가능 할 지 2) 2026.04.09 ~ 부터 참여 시작이 가능할 지 문의드립니다.","안녕하십니까 BK21사업팀입니다. 외국인등록증 발급 이전 체류기간에 대해 체류자격 및 참여요건 충족 확인이 가능하다면(사증발급확인서) 참여요건을 충족하는 기간 모두 참여 가능하나(사유서 및 사증발급확인서 추가 구비), 해당 사항이 불가하다면 참여요건 충족을 확인할 수 있는 기간부터 참여가 가능합니다. 감사합니다."
[Q&A] 학회 특별세션 결제 관련 문의 - 안녕하세요. 기분 좋은 하루보내시길 바랍니다. 참여교수 1명 국내 학회 참석 예정 / 사전등록비용 bk비용으로 결제 완료. 국내 학회에서 진행되는 특별세션 신청하여 비용을 납부하려고 합니다 (100만원). bk연구단 연구주제로 특별세션 진행할 예정이고 연구단 참여교수님과 외부 소속 연구원입니다. 연구활동 및 산학협력활동 지원비로 특별세션 비용 납부가능할까요? 감사합니다.,"안녕하세요. BK21사업팀입니다. 가능합니다.

(추가 답변) 참여인력에 대한 지원은 가능하지만 미참여인력에 대한 지원은 불가합니다. 감사합니다."
"참여교수 자격 재문의 - 16340 답변 관련하여 재문의 드립니다. 그러면 BK21 사업 수행을 하지 않는 '다'학과 소속이라도 겸직 발령된 '가'(미래인재양성사업), '나'(혁신인재양성사업)' 학과가 BK21 사업 수행학과일 때, 해당 겸직도 '소속'으로 간주되어 A 교수가 둘 중에 한 학과의 BK21 사업에 참여할 때 참여자격을 충족할 수 없는건가요? 만약 '다' 학과의 전임교원 A교수가 '가', '나'학과 중 하나의 겸직일 경우 겸직하는 학과의 BK21 참여교수로 참여할 수 있는지 확인 부탁드립니다.","안녕하십니까. BK21사업팀입니다. 다학과(BK21 미수행)에 전임교수이며, 가 또는 나 학과 중 하나의 겸직이라면 BK21 참여 가능합니다. (단, 미래인재양성사업의 경우에는 전임/겸임 비율 확인 필요) 추가 문의사항은 유선(042-869-6446)으로 문의바랍니다. 감사합니다."
