Question,Answer
"[Q&A] 신진연구인력, 대리체제 및 연구비 집행 관련 문의 - 안녕하십니까? BK21 사업 운영과 관련하여 아래와 같이 문의드립니다. 1. 신진연구인력 계약기간 및 계약 시작 시점 관련 BK21 사업 지침에 따르면 신진연구인력의 계약기간은 '1년 이상 2년 이내'로 규정되어 있는 것으로 확인하였습니다. 기존 신진연구인력이 2026.04.30.자로 계약 종료 예정입니다. 그래서 신규 신진연구인력 1인을 채용 예정인데, 계약기간을 2026.09.01 ~ 2027.08.31 (1년)으로 채용이 가능할까요? 위와 같이 사업연도 시작 시점(3월)이 아닌 9월부터 계약을 시작하는 경우에도 지침상 문제없이 채용이 가능한지 궁금합니다. 2. 연구년에 따른 교육연구단(팀) 대리체제 운영 관련 대리체제 운영 시 책임연구자(단장/팀장)와 대리자의 역할 및 권한 범위와 연구비 집행, 참여인력 관리, 사업 운영 등 주요 사항에 대해 대리자가 수행 가능한 범위 및 책임 주체에 대해 궁금합니다. 3. 협약 이전 연구비(카드) 사용 가능 여부 및 증빙 관련 교수님께서 협약 이전(2026.03.03.)에 연구비카드로 결제 진행하셨습니다. 4월에 사업비가 입금이 되어 집행 처리가 가능한 상황인데, 위와 같은 경우 협약 이전 사용 건에 대해 처리가 가능한지 여부와 가능하다면 사유서 등 추가로 필요한 증빙자료가 있는지 문의드립니다.","안녕하십니까. BK21사업팀입니다. 1. 가능합니다. 2. 대리체제의 경우, 교육연구단(팀)장 역할 수행이 어렵기에 대리체제를 운영하는 것으로 보입니다. 내부결재 등 대리체제 참여교수님께서 진행하는 것이 적절합니다. 3. 3/1 사업개시이므로 소급 적용 가능합니다. 세부절차 등은 대학 산학협력단 등에 확인하여 주시기 바랍니다. 감사합니다."
"참여교수 자격 문의 - 안녕하세요. BK21 사업 관련 참여교수 요건에 대해 문의드립니다. 신임교원 A는 '다' 학과 전임교원이며, '가' 및 '나' 학과에 겸직 발령된 상태입니다. '가' 학과는 미래인재양성사업, '나' 학과는 혁신인재양성사업을 수행 중입니다. 이 경우, 신임교원 A가 전공분야에 따라 '가' 또는 '나' 학과의 BK21 참여교수로 참여 가능한지 문의드립니다.","안녕하십니까 BK21사업팀입니다. 미래인재양성사업 수행학과 비참여교수(전임)는 타 미래인재양성사업 및 혁신인재양성사업 참여 불가합니다. 혁신인재양성사업 수행학과 비참여교수(전임, 겸임)은 미래인재양성사업 참여 불가합니다. 감사합니다."
"BK21 참여대학원생 자격 기준 관련 문의(4대 보험 가입 이력 관련) - 안녕하십니까. 두뇌한국(BK)21 사업 관련 참여대학원생 자격 기준에 대하여 문의드리고자 합니다. 먼저, 「4단계 두뇌한국21 사업관리 운영지침(2025.12.24.)」 제11조(참여대학원생)에 따르면, 참여대학원생은 '참여교수가 지도하는 학생 중 신청 학과(부)에 소속되어 주 40시간 이상 교육 및 연구에 전념하는 전일제 대학원생으로서, 고용보험, 건강보험(지역가입자 제외), 국민연금 및 산재보험 등 4대 보험에 가입되어 있지 않은 사람'으로 규정되어 있습니다. 이와 관련하여, 아래와 같은 사례의 대학원생들이 BK21 사업 참여가 가능한지 여부를 문의드립니다. 해당 대학원생 A~D는 모두 현재 미취업 상태의 전일제 대학원생으로 연구 및 학업에 전념하고 있으나, 과거 또는 현재 4대 보험 중 일부 가입 이력이 있어 참여자격 판단에 어려움이 있어 문의드립니다. ■ 사례별 현황 A 학생: 국민연금 지역가입자(자격취득일 2021.03.), 건강보험 지역세대주(자격취득일 2021.03.) / B 학생: 국민연금 지역가입자(자격취득일 2019.08.), 건강보험 직장피부양자(자격취득일 2025.05.) / C 학생: 국민연금 지역가입자(자격취득일 2024.03.), 건강보험 지역세대주(자격취득일 2026.01.) / D 학생: 국민연금 지역가입자(자격취득일 2025.01.), 건강보험 직장피부양자(자격취득일 2015.02.) ■ 문의사항: 상기 A~D 학생의 경우, 현재 미취업 상태임에도 불구하고 국민연금(지역가입자) 또는 건강보험(지역세대주/직장피부양자) 가입 이력이 있는 경우, BK21 참여대학원생으로 인정이 가능한지 여부를 문의드립니다. 만약 참여 가능 여부 판단을 위해 추가적인 소명이 필요하다면, 미취업 상태를 증빙하기 위한 서류 및 4대 보험 관련 자격 상태를 확인할 수 있는 자료 등 어떤 서류를 준비해야 하는지 안내해 주시면 감사하겠습니다.","안녕하십니까. BK21사업팀입니다. A~D 모두 참여가능합니다. 단, 창업 여부 등을 추가로 확인하여 주시기 바랍니다(사업참여 전 창업자는 BK21사업 참여 불가). 감사합니다."
"외국인 참여대학원생 참여자격 문의 - 안녕하세요. 이번학기 입학을 한 외국인 대학원생의 체류자격이 D-2가 아닌 F-4 입니다. 아직 외국인등록증 발급이 되지 않아 4대보험가입내역확인서 발급이 안되는 상태이며, 해당학생의 사증발급확인서를 받아 26.2.11 일자로 비자발급이 된 것을 확인하였습니다. 이 경우, 이 학생은 사증발급확인서를 구비한 상태로 추후 4대보험가입내역확인서를 발급받으면 26.3.1 일자로 참여가 가능할까요? 아니면 4대보험가입내역서를 발급받은 날을 참여시작일로 해야할까요? 이 학생은 입학일부터 현재까지 전일제로 학습 및 연구활동을 진행 중에 있습니다. 미리 답변에 감사드립니다. / 추가 질문: 사유서와 사증발급확인서를 구비한다면 4대보험, 건강보험 서류발급이 늦어져도 3월1일자로 참여 가능하다는 말씀인가요? 발급받을 수 있게되면 바로 발급받아 구비할 예정입니다.","안녕하십니까. BK21사업팀입니다. 원칙은 사업 참여 시 참여요건을 확인하여야 하며 매년 4/1, 10/1을 기준으로 4대보험가입내역확인서를 징구하여야 합니다. 외국인 유학생 중 D-2비자를 확인할 수 있는 경우에는 외국인등록증사본으로 대체 가능하나, 기재하여 주신 F-4비자의 경우에는 건강보험자격득실확인서 및 4대보험가입내역확인서를 구비하여야 합니다. 해당 참여대학원생이 참여요건을 충족하는 경우에는 사유서(서류 발급 지연에 대한 사유를 명확히 기재) 및 증빙자료(사증발급확인서)를 구비하여 주시고, 외국인등록증 발급 이후 건강보험자격득실확인서와 4대보험가입내역확인서를 추가 구비하여 주시기 바랍니다. 감사합니다."
"[BK21] 사업신청서 내 <제출증빙> 섹션 작성 방법 및 시스템 업로드 자료와의 중복 제출 확인 - 안녕하세요. 제4단계 BK21 사업 신청 준비 중, 제공된 사업신청서 한글 서식 내에 포함된 <제출증빙> 부분의 작성 방법과 관련하여 상세 확인이 필요하여 문의드립니다. 현재 연구비, 대표업적물, 특허/기술이전 실적 등은 시스템에 개별적으로 입력하고 증빙을 업로드하게 되어 있습니다. 본문 및 제출 증빙 탭에는 <제출증빙>이라는 표기되어 있습니다. 이에 대해 다음과 같이 질의합니다. 시스템 업로드 파일과의 중복 제출 여부: 시스템 실적 입력 탭에서 이미 입력 및 증빙 파일을 업로드 완료한 경우에도, 신청서 본문의 <제출증빙> 섹션에 동일한 증빙 자료를 양식에 맞춰 추가로 수록해야 하는지 궁금합니다. 감사합니다.",안녕하십니까 BK21사업팀입니다. 4단계 BK21사업 시범사업과 관련된 자료 작성은 BK21사업 공지사항을 확인하여 주시기 바랍니다. BK21 홈페이지 - 공지사항 - 시범사업 공고 - 첨부파일 - 본문 신청서 서식 참고바랍니다. 추가 문의 사항 또는 자세한 사항은 유선(042-869-6952)으로 문의바랍니다. 감사합니다.
종합정보관리시스템 KRI동기화 오류 문의 - 안녕하세요 종합정보시스템 참여교수관리 현행화 작업 중 최종학위가 KRI의 직급으로 동기화가 되지 않아 문의 드립니다. 교수님께서는 KRI내용 확인 하시고 어제 수정 하신 상태 입니다. 확인 부탁드립니다. 감사합니다.,"안녕하세요. BK21사업팀입니다. 시스템에 나오는 안내 문구인, 아래표의 [직급] 셀을 클릭하면 해당교수의 KRI의 직급으로 동기화됩니다. 이거 대로 해봐도 안된다는 말씀이시면, 042-869-6445 로 유선문의 부탁드립니다."
[교육연구단 홈페이지 관련] 안녕하세요. BK사업단(교육연구단) 홈페이지 관련하여 문의 드립니다. 현재 홈페이지에 기술상의 문제가 있어 홈페이지를 폐쇄해야 할 수 있는 상황입니다. 반드시 교육연구단 홈페이지를 운영해야 한다는 규정이 있나요? 규정상 가능하다면 홈페이지가 폐쇄되어도 괜찮은지 확인해 주시면 감사하겠습니다.,"안녕하세요. BK21사업팀입니다. 규정이 있습니다. 아래를 참고해 주시기 바랍니다. 4단계 BK21사업 관리 운영 지침 제61조(홈페이지 운영) ① 교육연구단의 장은 본 지침을 참고하여 정보공개, 사업성과 관리 및 홍보를 위한 홈페이지를 개설하여야 한다. ② 전문기관의 장은 교육연구단의 홈페이지 운영 상황을 평가에 반영할 수 있다."
"[16326건 추가 질문] 참여교수 겸임 문의 - 안녕하세요, 16326건 추가 질문입니다. 혁신인재양성 연구단 진행으로 융합학과(A)를 운영중에 있습니다. 혁신인재양성사업의 참여교수가 A학과 겸임 중입니다. A학과를 겸임하며, 추가 B학과 겸임을 고려하고 있는 상황입니다. 추가 겸임을 고려하는 B학과는 BK사업을 수행하지 않는 학과입니다. 추가 겸임을 하여도 현재 참여중인 혁신인재양성연구단의 참여교수로 문제가 없는지요, 감사합니다.",안녕하십니까 BK21사업팀입니다. B학과가 BK사업 수행학과가 아니라면 겸직 추가 가능합니다. 감사합니다.
"학회등록비 결제 및 국외출장 신청 관련 문의 - 안녕하세요. 최근 유류할증료가 급등하여, 9월 이후 개최되는 학회의 등록비 및 항공권을 미리 결제하는 경우가 많이 발생하고 있습니다. 이와 관련하여, 1. 현재 이번 학기(26년 1학기) 참여대학원생이나 다음 학기(26년 2학기)에는 연차초과자로 대상자에서 제외되는 경우 4월에 결제된 학회등록비나 항공권에 대해 5월에 집행을 해도 되는지 확인 후 답변 부탁드립니다. 2. 만약 불가한 경우, 카드 취소로 인한 항공권 및 등록비에 대한 수수료는 어떻게 처리를 해야하는지 답변 부탁드립니다.","안녕하십니까 BK21사업팀입니다. 1. 학회 개최 시점에 참여대학원생 신분을 유지하지 못하거나, 학회에 불참하는 경우 지원 불가합니다. 2. 취소수수료는 천재지변 또는 주최측의 일방적인 취소에 한하여 집행이 가능합니다(사유서 및 증빙자료 구비). 그 외 사유는 사업비에서 지원 불가합니다. 감사합니다."
국제 학술대회 등록비 및 멤버십 결제 문의 - 안녕하세요? 국제 학술대회 등록비 및 멤버십(회비 성격) 결제와 관련하여 문의드립니다. 등록비를 결제하는 과정에서 멤버십 결제가 필수인데 등록비 및 멤버십을 모두 국제화경비 항목으로 집행할 수 있을지 문의드립니다. 감사합니다.,"안녕하세요. BK21사업팀입니다. 국제학술대회 인정기준을 충족하며, 멤버십 가입이 참석을 위해 반드시 필요한 경우 사유서를 구비하여 집행 가능합니다."
"신진연구인력 퇴직 적립금 - 안녕하세요. 저희 연구단의 신진연구인력 (박사후과정 연구원)이 25년 12월 ~26년 2월에 무급 육아휴직을 하였습니다. 이에 연구원의 연구중단과 인건비 미지급 처리를 하였는데, 퇴직금도 미적립되었습니다. 그러나 신진연구원이 1년이상 연속근무자에 해당되어, 육아휴직 기간에도 퇴직금 적립이 필수임을 확인하였습니다. 1) 2025년도 연구기간이 종료되었으나, 2025년도 연구비로 퇴직금을 적립해도 될까요? (신진연구인력인건비의 연구비 잔액이 있기에, 사유서를 첨부하고 지출신청을 하고자 합니다.) 2) 아니면 2026년도 연구비에서 퇴직금을 적립해도 되는지요? 감사합니다.",안녕하십니까 BK21사업팀입니다. 신진연구인력 퇴직금 관리는 사업연도 종료 시 해당 사업연도 기간 동안의 퇴직금을 충당하여야 합니다(4단계 BK21사업 예산편성 및 집행기준 제15조). 1. 사업비 집행은 당해년도 집행이 원칙입니다. 2025년도 사업년도는 종료되었으므로 불가합니다. 2. 불가합니다. 해당 사업년도 기간의 퇴직금을 충당하는 것이 원칙입니다. 감사합니다.
"[참여대학원생 자격요건] 참여대학원생 자격요건 - 안녕하세요 업무에 노고가 많으십니다. 참여대학원생 자격요건 관련하여 문의드립니다. 아래의 사항에 해당되는 경우 참여대학원생으로 선발이 가능한지 궁금합니다. 참여대학원생으로 선발하고자 하는 학생이 해외 공동연구 참여를 위해 미국 대학에 파견될 경우 현지 대학과 연구조교(RA)형태로 활동하고 인건비는 미국NIH재원에서 해당 대학을 통해 직접 지급받을 예정입니다. (J-1비자 예정, 국내기관과의 근로계약 및 국내 4대보험 가입에는 영향을 미치지 않을 경우) 이와 같은 해외 연구활동이 BK참여대학원생으로서의 4대보험 미가입 전일제 대학원생의 요건을 충족되는 것으로 판단할수 있는것인지 해당 활동이 전일제 인정 여부에 영향을 미치는지 궁금합니다. 이전의 Q&A사례들을 살펴보았을때 해외대학에 공동연구를 하면서 체류시 만일 타 과제로 해외 체류한다면 참여대학원생 자격요건인 40시간 이상 BK21사업 교육 및 연구목적에 부합해야한다는 조건 부합하지 않으며 근로계약 등을 통해 인건비 수당을 받게 되는 경우 참여대학원생 자격요건을 충족할 수 없다는 답변들은 확인을 했습니다만 구체적인 저희 사례에 대해 조금더 확인해보고자 문의드립니다. 참고사항으로 본 사업단(팀)은 BK 장학금 지급은 하지않는 기관이며 참여대학원생으로 선발이 가능하다면 해외연수비용 (항공료 또는 체재비) 을 지급하고자 합니다.","안녕하십니까 BK21사업팀입니다. 국내 근로계약 및 4대보험 가입과 별개로, 해당 해외기관과의 근로계약 등이 체결되는 경우 BK21사업 참여가 불가합니다. 또한, 근로계약 여부와 상관없이 해당 활동으로 인해 주40시간 이상 교육연구단(팀)의 연구 및 교육에 전념할 수 없다면 참여종료하여야 합니다. 해당 활동으로 인해 휴학을 하는 경우에도 참여종료가 필요합니다(휴학생은 BK21 참여불가). 감사합니다."
"타 과제 선정으로 인한 대학원생의 참여 제외 가능 여부 문의드립니다. - 참여대학원생이 BK21 과제와 장학금/인건비 중복 수혜가 불가능한 과제(예: 연구재단 석박사연구장려금 지원사업)에 지원하여 선정된 경우, 해당 학생을 BK21 참여 대학원생 목록에서 제외하는 것이 가능할지 문의드립니다. 감사합니다.","안녕하십니까

BK21사업팀입니다.

가능합니다(참여종료 사유서 및 건강보험자격득실확인서 구비 필요).

감사합니다."
참여대학원생 장학금 지급 기간 문의 - 박사수료생이 2025-1학기(25.03~25.08)에 장학금을 받고 2025-2학기에는 받지 않았습니다. 이때 이 박사수료생이 26.03~26.04 2개월만 장학금을 받고 지급을 중지할 수 있나요??(BK는 계속 참여),"안녕하십니까

BK21사업팀입니다.

해당 사항은 불가합니다.

지원대학원생은 최소 1개 학기(연속 6개월) 이상 장학금 지급이 가능하여야 합니다.

감사합니다."
"국제화 경비 집행 관련 문의 - 안녕하세요. 국제화 경비 집행 관련 문의드립니다. Q&A 확인 시, 국제 학술대회 공동 개최하는 경우 기타 경비 지원이 가능함으로 확인하였습니다. (공동 주최임이 확인 가능한 관련 내부증빙 및 계획서 모두 구비할 예정입니다.) 기타국제화경비 세목 : 기타연구개발서비스활용비, 국내출장비, 시내교통비, 학회세미나참가비, 특허수수료, 기타수수료 > 사용 예정 항목 : 인쇄비, 대관료, 행사개최비, 강사료, 연사분 체배비(숙박,교통 등.) 사용 예정 항목 모두 기타연구개발서비스활용비로 집행해도 되는지 문의드립니다. 문의드리는 이유는 기타국제화경비 세목에 편성된 교통비를 제외한 나머지 부분은 어느 항목으로 집행하는게 맞는지 확인하고자합니다. 감사합니다.","안녕하십니까. BK21사업팀입니다. 작성해주신 세목에 대해서는 교내 산학협력단의 확인이 필요한 것으로 판단됩니다. 인쇄비, 대관료, 행사개최비는 국제화경비 - 기타국제화경비에서, 연사가 해외학자에 해당한다면 강사료 및 체제비, 여비는 국제화경비 - 해외학자 초빙에서, 국내인사에 해당한다면 교육연구단 운영비 - 학술활동지원비에서 집행 가능합니다. 감사합니다."
참여교수 겸임 문의 - 안녕하세요. 참여교수 겸임관련 문의 드립니다. 저희 연구단은 혁신인재양성 교육연구단으로 융합학과를 운영중입니다. 참여교수가 본 소속이 있고 저희 융합학과를 겸임하고 계십니다. 추가로 BK 해당학과가 아닌 학과에 추가 겸임을 고려하고 있습니다. 추가 겸임하여도 사업참여에 문제가 없는지 확인 부탁드립니다. 감사합니다.,"안녕하십니까 BK21사업팀입니다. BK21 수행사업의 종류와 겸임을 고려하고 있는 학과의 BK21 수행여부에 따라 달라질 수 있습니다. 본 소속학과, 겸임을 고려하고 있는 학과의 BK21 수행여부 및 사업(미래/혁신)을 확인하여 주시기 바랍니다. 감사합니다."
"교육연구단 주최 국제학술대회 경비 집행 관련 - 안녕하세요. 미래인재양성 과학기술분야 입니다. 본 교육연구단 주최로 국내 소재지에서 국제학술대회를 개최하고자 합니다. 아래의 기준에 부합해야만 국제화경비(전문가활용 연사료 및 여비(항공/숙박/체재비)) 및 기타국제화경비(대관료 등 행사비)를 사용할 수 있는지, 아니면 부합하지 않아도 집행가능한 것인지 문의드립니다. [국제(학술)대회 인정기준] ○ 과학기술 분야 : 4개국 이상이 참여하며 총 구두발표 논문이 20건 이상, 구두발표 논문 발표자 중 외국기관 소속 외국인이 50% 이상(다만, 국내 개최 시에는 3분의 1 이상)",안녕하세요. BK21사업팀입니다. 집행 가능합니다.
"BK21사업 참여인력 정보 현행화 관련 문의 - 안녕하세요, BK21사업 참여인력 정보 현행화 관련하여 4/24(금)까지 완료하라는 안내를 받았습니다. bk종합정보시스템에서 [교육연구단정보/성과관리] > [참여인력관리] 에서 참여교수, 참여대학원생, 참여신진연구인력 관리 부분에서 26년도 1학기 참여자 정보를 기입하면 되는 것일까요? 혹은 증빙서류를 업데이트 해야 하는 것일까요? 내용 확인하여 주시면 감사하겠습니다!","안녕하세요 BK21사업팀입니다.

증빙은 별도로 구비해주시기 바라며, 

시스템에서는 해당 인력 및 대학원생 참여 정보와 지원 내용(인건비, 연구장학금)에 대해 현행화 해주시기 바랍니다.

감사합니다."
[Q&A] 국제 학술대회 등록비 및 프로시딩 결제 관련 문의 - 안녕하세요? 국제 학술대회 등록비 및 프로시딩 결제와 관련하여 문의드립니다. 국제 학술대회 등록비 결제 단계에서 금년 학술대회 프로시딩 출력본 구매 여부를 선택하여 함께 결제할 수 있는 옵션이 있습니다. (따로 결제는 불가) 해당 부분 국제화경비 항목으로 같이 결제하는 것이 가능할지 문의드립니다. 감사합니다.,안녕하십니까 BK21사업팀입니다. 해당 프로시딩 구입이 학회등록 시 필수라면 가능합니다. 감사합니다.
"25년도 참여대학원생 미등록 - 안녕하세요. 현재 참여인력 정보 등을 제대로 등록하였는지 확인하는 작업을 하고 있는데요. 이전 행정직원(담당자)이 참여대학원생을 미등록한 부분을 확인하였습니다. 학생은 25.9월에 신규추가된 대학원생이며, 10.1일자로 자퇴하여 과제에서 참여제외되었습니다. 확인해보니 KRI에도 정보가 모두 기입되어있지 않아 등록을 완료할 수 없습니다. 이런 경우 어떻게 처리해야할까요? 이 학생이 1달간 참여했고, 100만원 장학금 지급도 받았는데. 참여대학원생 관리에 그 기록을 꼭 남겨야하는 거죠?","안녕하십니까

BK21사업팀입니다.

해당 사항은 유선(042-869-6446)으로 문의바랍니다.

감사합니다."
"중간평가 추진 일정 관련 문의 - 안녕하세요. 미래인재양성사업 사업팀입니다. 2026년도 미래인재양성사업사업 2차 중간평가와 관련하여 문의드립니다. 공개된 공지사항에 따르면 평가 일정안은 아래와 같이 안내되어 있는 것으로 확인하였습니다. 보고서 서식(초안) 공개: 3월 중, 보고서 접수: 6~7월 중, 보고서 평가: 8~9월 중. 4월 현재 아직 보고서 서식 공개 관련 추가 안내가 아직 없는 상황으로, 이에 따라 다음 단계인 보고서 접수 일정에도 변동이 있는지 확인하고자 합니다. 답변 주시면 감사하겠습니다.",안녕하십니까 BK21사업팀입니다. 중간평가에 관련된 사항은 추후 공문 및 공지사항을 참고하여 주시기 바랍니다. 감사합니다.
"신진연구인력(포닥) 계약 기간 문의 - 안녕하세요, BK21 사업에 참여하는 신진연구인력 계약 관련으로 문의사항이 있습니다. BK21 사업에서는 신진연구인력의 계약기간은 1년 이상 2년이내로, 최대 4년까지 계약기간 갱신/연장할 수 있다고 정의하고 있습니다. 이때 계약기간은 ""총 기간""으로 이해하면 될지 문의드립니다. 계약서 상의 계약 기간은 쪼개져 있더라도 해당자가 참여한 기간이 총 12개월이면 문제가 없을까요? 예를 들어 기존에 12개월을 계약하고 재계약 시점입니다. 이때 재계약 시 10개월로 임용을 했다고 가정할 때 총 기간이 12개월이 넘었기 때문에 문제가 되지 않을지 확인 해주시면 감사하겠습니다. 언제나 업무에 많은 도움주셔서 감사합니다.",안녕하십니까 BK21사업팀입니다. 근로계약서에서 확인되는 계약기간이 1년 이상 2년이내여야 합니다. (재계약 시에도 1년이상 2년 이내 계약) 감사합니다.
"해외학자 초빙 가능 여부 문의 - 안녕하세요. 저희 연구단에서는 해외학자를 초빙하는 세미나를 진행하고자 합니다. 아래와 같은 상황에서 해외학자 초빙 비용 지출이 가능한지 문의드립니다. 1. 당초 해외학자초빙 계획이 없어, 종합정보시스템의 예산운영계획에 있는 '해외석학초빙'에는 예산이 반영되지 않은 상황입니다. 2. 인건비, 국제화경비 등 다른 항목의 잔여 예산을 전용하여, 해외학자를 초빙하는 세미나를 개최 및 지원하고자 내부 논의 중입니다. 3. 「4단계 두뇌한국(BK)21 사업 예산편성 및 집행기준」제18조제5항제5호에서는 예외적으로 해외학자의 원격 화상강의료, 자문료 지급에 대해 사업신청서 또는 연차별 예산운영계획에 사전에 명시되어 있어야 가능하다고 되어 있습니다. 4. 저희 연구단은 해외학자를 초빙 시, 해외학자의 원격 화상강의료, 자문료 지급이 아닌 항공료 등 여비와 체재비 정도만 지원(제18조제5항제1호)하려고 합니다.","안녕하십니까. BK21사업팀입니다. 자체 내부품의 등을 통해 비목 변경 후 정산시 반영하여 주시기 바랍니다. 해외학자는 해외 소재 대학, 연구소, 기업체 소속의 교수 또는 연구원이어야 하오니 유의바랍니다. (4단계 BK21사업 관리운영지침 제14조의3) 감사합니다."
